{
  "assumptions_used": [
    "CHG-B11.ASSUMPTION-MANIFEST"
  ],
  "claim": {
    "assumption_manifest": {
      "conditions": [
        "K>=1",
        "p>1",
        "rho>0",
        "a>b>c>0"
      ],
      "family": "directional_positive_part_power_hg",
      "node": "continuous_hg_assumptions",
      "semantic_manifest": {
        "admission": "all_pair_and_global_family_equations",
        "data": "exact_consecutive_active_decreases",
        "domain": [
          "K>=1",
          "p>1",
          "rho>0",
          "a>b>c>0"
        ]
      }
    },
    "component": "triple_root",
    "expected": [
      0,
      true,
      true,
      true
    ],
    "inputs": {},
    "node": "continuous_hg_result",
    "result_id": "CHG-B11"
  },
  "claim_sha256": "e1d6e5b3319e080147493ad791008d78a2a8bc02758ab8688eff7e83995b5ead",
  "formal_statement_sha256": "3678fd7d865494bf27e17499109966656bbd908681b58b6bc401c907d81f1dbb",
  "foundation_dependencies": [
    "FOUND-REAL-001",
    "FOUND-CONVEX-001",
    "FOUND-LIMIT-001"
  ],
  "payload": {
    "anti_vacuity": {
      "assumption_count": 1,
      "conclusion_is_not_assumption": true
    },
    "assumption_manifest": {
      "conditions": [
        "K>=1",
        "p>1",
        "rho>0",
        "a>b>c>0"
      ],
      "family": "directional_positive_part_power_hg",
      "node": "continuous_hg_assumptions",
      "semantic_manifest": {
        "admission": "all_pair_and_global_family_equations",
        "data": "exact_consecutive_active_decreases",
        "domain": [
          "K>=1",
          "p>1",
          "rho>0",
          "a>b>c>0"
        ]
      }
    },
    "assumption_model": {
      "K": 3,
      "a": "3/5",
      "b": "1/2",
      "c": "2/5",
      "p": 2,
      "rho": 5
    },
    "assumption_model_result": true,
    "claim": {
      "assumption_manifest": {
        "conditions": [
          "K>=1",
          "p>1",
          "rho>0",
          "a>b>c>0"
        ],
        "family": "directional_positive_part_power_hg",
        "node": "continuous_hg_assumptions",
        "semantic_manifest": {
          "admission": "all_pair_and_global_family_equations",
          "data": "exact_consecutive_active_decreases",
          "domain": [
            "K>=1",
            "p>1",
            "rho>0",
            "a>b>c>0"
          ]
        }
      },
      "component": "triple_root",
      "expected": [
        0,
        true,
        true,
        true
      ],
      "inputs": {},
      "node": "continuous_hg_result",
      "result_id": "CHG-B11"
    },
    "derivation": {
      "component": "triple_root",
      "equation": "(3/2)^s+(1/2)^s=2",
      "positive_root": 1,
      "result_id": "CHG-B11",
      "strict_convexity": true
    },
    "mutant_ids": [
      "CHG-B11.MUTANT.CONCLUSION",
      "CHG-B11.MUTANT.ASSUMPTION",
      "CHG-B11.MUTANT.COMPONENT",
      "CHG-B11.MUT.LOCAL-TRIPLE-IS-GLOBAL"
    ],
    "observed": [
      0,
      true,
      true,
      true
    ],
    "semantic_kernel_version": "analytic-semantics-1.0.0"
  },
  "proof_goal_id": "CHG-B11.TRIPLE.03",
  "proof_id": "CHG-B11.TRIPLE.03.SEMANTIC.PROOF",
  "proof_method": "SemanticDerivationProof",
  "result_dependencies": [
    "CHG-B2",
    "CHG-B9"
  ],
  "result_id": "CHG-B11",
  "schema_version": "1.1.0"
}
