{
  "assumptions_used": [
    "CALC-R13.EXACT-FINITE-MODEL"
  ],
  "claim": {
    "left": {
      "domain": {
        "node": "list",
        "values": [
          -1,
          0,
          1
        ]
      },
      "node": "select",
      "predicate": {
        "arguments": [
          {
            "left": {
              "name": "x",
              "node": "variable"
            },
            "node": "greater",
            "right": 0
          },
          {
            "left": {
              "key": {
                "name": "x",
                "node": "variable"
              },
              "map": {
                "entries": [
                  {
                    "key": -1,
                    "value": "loss"
                  },
                  {
                    "key": 0,
                    "value": "tie"
                  },
                  {
                    "key": 1,
                    "value": "win"
                  }
                ],
                "node": "finite_map"
              },
              "node": "lookup"
            },
            "node": "not_equal",
            "right": "tie"
          }
        ],
        "node": "and"
      },
      "variable": "x"
    },
    "node": "equal",
    "right": {
      "node": "list",
      "values": [
        1
      ]
    }
  },
  "claim_sha256": "dfde8d288dc29cd80dd79e7fcd0f80ee66f346726f7d86172baec9172356e8b0",
  "formal_statement_sha256": "92a76606d7bdee95d7032a8af8211b27c8032a1d9eeaff288c9869fb0356e689",
  "foundation_dependencies": [
    "FOUND-FINITE-001"
  ],
  "payload": {
    "expected": {
      "node": "list",
      "values": [
        1
      ]
    },
    "expression": {
      "domain": {
        "node": "list",
        "values": [
          -1,
          0,
          1
        ]
      },
      "node": "select",
      "predicate": {
        "arguments": [
          {
            "left": {
              "name": "x",
              "node": "variable"
            },
            "node": "greater",
            "right": 0
          },
          {
            "left": {
              "key": {
                "name": "x",
                "node": "variable"
              },
              "map": {
                "entries": [
                  {
                    "key": -1,
                    "value": "loss"
                  },
                  {
                    "key": 0,
                    "value": "tie"
                  },
                  {
                    "key": 1,
                    "value": "win"
                  }
                ],
                "node": "finite_map"
              },
              "node": "lookup"
            },
            "node": "not_equal",
            "right": "tie"
          }
        ],
        "node": "and"
      },
      "variable": "x"
    }
  },
  "proof_goal_id": "CALC-R13.MISMATCH.01",
  "proof_id": "CALC-R13.MISMATCH.01.PROOF",
  "proof_method": "ExactFiniteComputationProof",
  "result_dependencies": [],
  "result_id": "CALC-R13",
  "schema_version": "1.1.0"
}
